track_id,track_name,track_artist,lyrics,track_popularity,track_album_id,track_album_name,track_album_release_date,playlist_name,playlist_id,playlist_genre,playlist_subgenre,tempo,duration_ms,language
00QyLmjxaSEE8qIZQjBXBj,We Own It (Fast & Furious),2 Chainz,"It's Young Khalifa, man2 Chainz! Money's the motivation, money's the conversation You on vacation, We gettin' paid so We on paycation, I did it for the fam It's whatever we had to do, it's just who I am Yeah, it's the life I chose Gunshots in the dark, one eye closed And we got it cooking like a one-eyed stove You can catch me kissing my girl with both eyes closed Perfecting my passion, thanks for asking Couldn't slow down so we had to crash it You used plastic, we 'bout cash I see some people ahead that we gon' pass I never feared death or dying I only fear never trying I am whatever I am Only God can judge me now One shot, everything rides on tonight Even if I've got three strikes I'ma go for it This moment, we own it And I'm not to be played with Because it can get dangerous See these people I ride with This moment, we own it And the same ones that I ride with Be the same ones that I die with Put it all out on the line with If you looking for me you can find Wiz In the new car or in the crown with My new broad, that's a fine chick And the wonder squad, I'm down with Ain't no way around it What you say, tell me what you say Working hard, reppin' for my dogs, do this every day Takin' off, looking out for all, makin' sure we ball Like the mob, all you do is call Catch you if you fall, Young Khalifa I never feared death or dying I only fear never trying I am whatever I am Only God can judge me now One shot, everything rides on tonight Even if I've got three strikes I'ma go for it This moment, we own it And I'm not to be played with Because it can get dangerous See these people I ride with This moment, we own it (I ride or die for love) This the biggest day of my life We got big guns, been graduated from knives It's the day in the life and I'm ready to ride Got the spirit, I'm feelin' like a killer inside Financial outbreak, I'm free but I ain't out yet Ridin with the plug so I'm close to the outlet At the red light, rims sittin' offset I look better on your girl than her outfit Stuck to the plan, always think that we would stand up, never ran We the fam and loyalty never change up Been down since day one, look at where we came from Jumpin out on anybody who try to say some one thing about it Got a problem, I got the same one Money rolls, we fold Plently clubs we closed Follow the same code Never turn our backs, our cars don't even lose control One shot, everything rides on tonight Even if I've got three strikes I'ma go for it This moment, we own it And I'm not to be played with Because it can get dangerous See these people I ride with This moment, we own it I ride or die for mine I'm ride or die material Only one life to live, so here we go (This moment, we own it) It's Young Khalifa, man2 Chainz! Money's the motivation, money's the conversation You on vacation, We gettin' paid so We on paycation, I did it for the fam It's whatever we had to do, it's just who I am Yeah, it's the life I chose Gunshots in the dark, one eye closed And we got it cooking like a one-eyed stove You can catch me kissing my girl with both eyes closed Perfecting my passion, thanks for asking Couldn't slow down so we had to crash it You used plastic, we 'bout cash I see some people ahead that we gon' pass I never feared death or dying I only fear never trying I am whatever I am Only God can judge me now One shot, everything rides on tonight Even if I've got three strikes I'ma go for it This moment, we own it And I'm not to be played with Because it can get dangerous See these people I ride with This moment, we own it And the same ones that I ride with Be the same ones that I die with Put it all out on the line with If you looking for me you can find Wiz In the new car or in the crown with My new broad, that's a fine chick And the wonder squad, I'm down with Ain't no way around it What you say, tell me what you say Working hard, reppin' for my dogs, do this every day Takin' off, looking out for all, makin' sure we ball Like the mob, all you do is call Catch you if you fall, Young Khalifa I never feared death or dying I only fear never trying I am whatever I am Only God can judge me now One shot, everything rides on tonight Even if I've got three strikes I'ma go for it This moment, we own it And I'm not to be played with Because it can get dangerous See these people I ride with This moment, we own it (I ride or die for love) This the biggest day of my life We got big guns, been graduated from knives It's the day in the life and I'm ready to ride Got the spirit, I'm feelin' like a killer inside Financial outbreak, I'm free but I ain't out yet Ridin with the plug so I'm close to the outlet At the red light, rims sittin' offset I look better on your girl than her outfit Stuck to the plan, always think that we would stand up, never ran We the fam and loyalty never change up Been down since day one, look at where we came from Jumpin out on anybody who try to say some one thing about it Got a problem, I got the same one Money rolls, we fold Plently clubs we closed Follow the same code Never turn our backs, our cars don't even lose control One shot, everything rides on tonight Even if I've got three strikes I'ma go for it This moment, we own it And I'm not to be played with Because it can get dangerous See these people I ride with This moment, we own it I ride or die for mine I'm ride or die material Only one life to live, so here we go (This moment, we own it) It's Young Khalifa, man2 Chainz! Money's the motivation, money's the conversation You on vacation, We gettin' paid so We on paycation, I did it for the fam It's whatever we had to do, it's just who I am Yeah, it's the life I chose Gunshots in the dark, one eye closed And we got it cooking like a one-eyed stove You can catch me kissing my girl with both eyes closed Perfecting my passion, thanks for asking Couldn't slow down so we had to crash it You used plastic, we 'bout cash I see some people ahead that we gon' pass I never feared death or dying I only fear never trying I am whatever I am Only God can judge me now One shot, everything rides on tonight Even if I've got three strikes I'ma go for it This moment, we own it And I'm not to be played with Because it can get dangerous See these people I ride with This moment, we own it And the same ones that I ride with Be the same ones that I die with Put it all out on the line with If you looking for me you can find Wiz In the new car or in the crown with My new broad, that's a fine chick And the wonder squad, I'm down with Ain't no way around it What you say, tell me what you say Working hard, reppin' for my dogs, do this every day Takin' off, looking out for all, makin' sure we ball Like the mob, all you do is call Catch you if you fall, Young Khalifa I never feared death or dying I only fear never trying I am whatever I am Only God can judge me now One shot, everything rides on tonight Even if I've got three strikes I'ma go for it This moment, we own it And I'm not to be played with Because it can get dangerous See these people I ride with This moment, we own it (I ride or die for love) This the biggest day of my life We got big guns, been graduated from knives It's the day in the life and I'm ready to ride Got the spirit, I'm feelin' like a killer inside Financial outbreak, I'm free but I ain't out yet Ridin with the plug so I'm close to the outlet At the red light, rims sittin' offset I look better on your girl than her outfit Stuck to the plan, always think that we would stand up, never ran We the fam and loyalty never change up Been down since day one, look at where we came from Jumpin out on anybody who try to say some one thing about it Got a problem, I got the same one Money rolls, we fold Plently clubs we closed Follow the same code Never turn our backs, our cars don't even lose control One shot, everything rides on tonight Even if I've got three strikes I'ma go for it This moment, we own it And I'm not to be played with Because it can get dangerous See these people I ride with This moment, we own it I ride or die for mine I'm ride or die material Only one life to live, so here we go (This moment, we own it)",59,1jg2UPoSAr7CDPsEXcabo1,Fast & Furious 6,2013-01-01,RAP Gangsta,1Z1gW89x4MSBjkvVjGg7DQ,rap,gangster rap,171.96599999999995,227893,en
00ReeHCY0FQUyuAUyPJdnk,Ain't No Future In Yo' Frontin',MC Breed,"Intro : (Flavor Flav) To the beat Ya'll Ah yeah(Ya don't stop) Sound good to me This sound hard, somethin' funky people gon' dance to Give the record a second and a chance to Hittin' people like a scene of amazement While they slippin' back, my feet is planted in the pavement Crumble I can never do So now I'm lookin' dead at you What are you gonna do? You listen to the knowledge of a scholar You say ""How Breed?"" tell em how I holler I'm the E Double, and I proclaim my name Straight up good game, peeps all game I'm like a rhino runnin' through the roughest pack They figure I'm a trigga-happy nigga, so they step back Breed, the microphonist Boot last the longest The noose's the strongest It ain't a game, that's plain to see You listen to the sounds of Breed (and the DFC) There ain't no future in your frontin' I never got caught with a kilo And if you ever do, yo, it will never be with me, yo Servin' in a Cherokee or maybe it's a GTO Black-on-black Benzo, I get it at Never have to worry bout my posse gettin' jumped Cause if we ever do, yo TB, pop the trunk Cause we don't go for playin', when I play go grab a ball When I'm on the mic I ain't for playin', not at all Cause I clock 10 g's a week boomin' at my peak Always seek E sober, but I do get geeked I can give you a job, a place to eat hearty Meet your homeboy Marty at a b.o.b. party Takin' over, barkin' like a dog named Rover (woof!) I'm pickin' suckers like a four-leaf clover They're bitin' lyrics on the mic, I diss these cobras So now they're sayin', ""Eric Breed is gettin' over"" There ain't no future in your frontin' Ha-ha-ha There ain't no future in your frontin' I'm the B, the r to the double e-d and Down with my homie G-a-s and O.E. and Suckers causin' static, cause they still be disagreein' I don't give a - cause I'm from F-l-i-n-t'n A city where pity runs low If you ever shoot through my city, now you know Cause we are strictly business and we also got our pride And if you don't like it, I suggest you break wide Suckers steady lookin' for the m-o-n-e-y and Thinkin' that illegal is the best way, so they dyin' I ain't got time to see a fiend fiend out To give up all his money, and he givin' what he got That's the way I am, MC Breed cannot be different Never change my ways for the world or the government If I was the president, then I would state facts You leave it up to me, I paint the white house black It ain't no future in your frontin' There ain't no future in your frontin' Yeah, I got dollars in my pocket, not from rollin'If I was a fiend, then my gold would be stolen Put my name Breed on everything I own And when I get my jeep I'm puttin' 'Breed' on the chrome Shine it up good, kickin' through my neighborhood Motorola phone, fat rims and a Kenwood Quick to get around it, and then I'll have it drop Simply cause I'm ridin' people think I'm sellin' rocks But ain't no future in your frontin' Yo Flash man, drop that, man Won't you drop that (Keep on) (To the beat ch'all) Cruel to the rules of the world Live my life raw, cause I never liked the law Wear top tens, on my ass use jeans Sellin' big 8ths and tit-for-tat to the fiends Clock much dollars, but I never break a sweat Time to move out, my posse sayin' (bet) You got my back, and I got yours What time is it? Hm, Tear down the doors Man There ain't no future in your frontin' Never was, cuz There ain't no future in your frontin' Hey man, let's start this party up, right?(Beat y'all) (Keep on) Intro : (Flavor Flav) To the beat Ya'll Ah yeah(Ya don't stop) Sound good to me This sound hard, somethin' funky people gon' dance to Give the record a second and a chance to Hittin' people like a scene of amazement While they slippin' back, my feet is planted in the pavement Crumble I can never do So now I'm lookin' dead at you What are you gonna do? You listen to the knowledge of a scholar You say ""How Breed?"" tell em how I holler I'm the E Double, and I proclaim my name Straight up good game, peeps all game I'm like a rhino runnin' through the roughest pack They figure I'm a trigga-happy nigga, so they step back Breed, the microphonist Boot last the longest The noose's the strongest It ain't a game, that's plain to see You listen to the sounds of Breed (and the DFC) There ain't no future in your frontin' I never got caught with a kilo And if you ever do, yo, it will never be with me, yo Servin' in a Cherokee or maybe it's a GTO Black-on-black Benzo, I get it at Never have to worry bout my posse gettin' jumped Cause if we ever do, yo TB, pop the trunk Cause we don't go for playin', when I play go grab a ball When I'm on the mic I ain't for playin', not at all Cause I clock 10 g's a week boomin' at my peak Always seek E sober, but I do get geeked I can give you a job, a place to eat hearty Meet your homeboy Marty at a b.o.b. party Takin' over, barkin' like a dog named Rover (woof!) I'm pickin' suckers like a four-leaf clover They're bitin' lyrics on the mic, I diss these cobras So now they're sayin', ""Eric Breed is gettin' over"" There ain't no future in your frontin' Ha-ha-ha There ain't no future in your frontin' I'm the B, the r to the double e-d and Down with my homie G-a-s and O.E. and Suckers causin' static, cause they still be disagreein' I don't give a - cause I'm from F-l-i-n-t'n A city where pity runs low If you ever shoot through my city, now you know Cause we are strictly business and we also got our pride And if you don't like it, I suggest you break wide Suckers steady lookin' for the m-o-n-e-y and Thinkin' that illegal is the best way, so they dyin' I ain't got time to see a fiend fiend out To give up all his money, and he givin' what he got That's the way I am, MC Breed cannot be different Never change my ways for the world or the government If I was the president, then I would state facts You leave it up to me, I paint the white house black It ain't no future in your frontin' There ain't no future in your frontin' Yeah, I got dollars in my pocket, not from rollin'If I was a fiend, then my gold would be stolen Put my name Breed on everything I own And when I get my jeep I'm puttin' 'Breed' on the chrome Shine it up good, kickin' through my neighborhood Motorola phone, fat rims and a Kenwood Quick to get around it, and then I'll have it drop Simply cause I'm ridin' people think I'm sellin' rocks But ain't no future in your frontin' Yo Flash man, drop that, man Won't you drop that (Keep on) (To the beat ch'all) Cruel to the rules of the world Live my life raw, cause I never liked the law Wear top tens, on my ass use jeans Sellin' big 8ths and tit-for-tat to the fiends Clock much dollars, but I never break a sweat Time to move out, my posse sayin' (bet) You got my back, and I got yours What time is it? Hm, Tear down the doors Man There ain't no future in your frontin' Never was, cuz There ain't no future in your frontin' Hey man, let's start this party up, right?(Beat y'all) (Keep on)",48,7mLks5uEIPmT0056mb5oV3,MC Breed & DFC,1991-01-01,Minitruckin Playlist,0VVH2Nzj6kBVGK3WIUQMAw,rap,southern hip hop,102.192,244733,en
00Ro1lnV3V6i87aY4t8Q43,La rebelion,Joe Arroyo,"NA Quiero contarle, mi hermano un pedacito de la historia negra De la historia nuestra, caballero, y dice así ¡Uh! ¡Dice! En los años mil seiscientos, cuando el tirano mandóLas calles de Cartagena, aquella historia vivió Cuando aquí llegaban esos negreros, africanos en cadenas Besaban mi tierra, esclavitud perpetua Esclavitud perpetua Esclavitud perpetua Que lo diga Salomé Un matrimonio africano, esclavos de un español Él les daba muy mal trato y a su negra le pegó Y fue allí, se reveló el negro guapo Tomó venganza por su amor Y aún se escucha en la verja, ""No le pegue a mi negra"" No le pegue a la negra No le pegue a la negra Oye, man, no le pegue a la negra No le pegue a la negra No, no, no ,no, no, no No, no, no, no, no, no No le pegue a la negra Oye, esa negra se me respeta No le pegue a la negra Eh, que aún se escucha, se escucha en la verja No le pegue a la negra No-no-no-no-no, no-no-no-no-no No-no-no-no le pegue a la negra No le pegue a la negra Negra que me dice en el chambaracaté, chambaracatéNo le pegue a la negra No le pegue a la negra No le pegue a la negra No le pegue a la negra No le pegue Y con ustedes, Chelito de Castro Vamos a ver, que le pegue a jeva No le pegue a la negra Porque el alma, que el alma, que el alma Que el alma, que el alma se me revienta No le pegue a la negra Eh, no, no, no, no, no, no le pegue a mi negra No le pegue a la negra Porque el alma se me agita, mi prieta No le pegue a la negra El Chombo lo sabe Y tú también, uh No le pegue a la negra",68,4168LZnMKT5rgITtNBbo5z,Sabor a Salsa,2007-05-12,Paraiso Tropical,37i9dQZF1DWYey22ryYM8U,latin,tropical,107.951,376013,es
00S35gEf40z03JTJgvQMqi,It's You - Radio Edit,Syn Cole,"Paints like a picture, sings like a melody Law of attraction feels like chemistry Yeah, it's a jungle out in the street You gotta fight for the things you need Every direction is lost to fate Somewhere they swear it changes I know it's you All of the emotion hit me in the moment I know it's you Every missed connection somehow was a blessing I know it's you Paints like a picture, sings like a melody Law of attraction feels like chemistry Yeah, it's a jungle out in the street You gotta fight for the things you need Every direction is lost to fate Somewhere they swear it changes I know it's you All of the emotion hit me in the moment I know it's you Every missed connection somehow was a blessing I know it's you",51,34u7JI9MqdhGSkhMNrlDST,It's You,2015-04-07,ElectroPop,0cuHKz65ZPqBX1brG8djlg,pop,electropop,127.957,211875,en
00SmB7n85SKROGjybsyq5i,Bongo Bong,Manu Chao,"Mama was queen of the mambo Papa was king of the Congo Deep down in the jungle I start bangin' my first bongo Every monkey'd like to be In my place instead of me 'Cause I'm the king of bongo, baby I'm the king of bongo bong I went to the big town Where there is a lot of sound From the jungle to the city Looking for a bigger crown So I play my boogie For the people of big city But they don't go crazy When I'm bangin' on my boogie I'm the (King  kthe bongo, king of the bongo bong Hear me when I come, baby King of the bongo King of the bongo bong Nobo Dy'd like to be in my place instead of me 'Cause nobody go crazy when I'm bangin' on my boogie I'm a king without a crown hanging loose in a big town But I'm the king of bongo baby I'm the king of bongo bong King of the bongo King of the bongo bong Hear me when I come, baby King of the bongo King of the bongo bong Hear me when I come They say that I'm a clown Making too much dirty sound They say there is no place for little monkey in this town Nobody'd like to be in my place instead of me 'Cause nobody go crazy when I'm bangin' on my boogie I'm the (King  kthe bongo, king of the bongo bong) Hear me when I come, baby King of the bongo King of the bongo bong Hear me when I come Bangin' on my bongo, all that swing belongs to me I'm so happy there's nobody in my place instead of me I'm a king without a crown hanging loose in a big town I'm the king of bongo baby I'm the king of bongo bong King of the bongo King of the bongo bong) Hear me when I come, baby (king of the bongo, king of the bongo bong Hear me when I come Mama was queen of the mambo Papa was king of the Congo Deep down in the jungle I start bangin' my first bongo Every monkey'd like to be In my place instead of me Cause I'm the king of bongo, baby I'm the king of bongo bong Hear me when I come Je ne t'aime plus mon amour Je ne t'aime plus tous les jours Je ne t'aime plus mon amour Je ne t'aime plus tous les jours Parfois j'aimerais mourir, tellement j'ai voulu croire Parfois j'aimerais mourir, pour ne plus rien avoir Parfois j'aimerais mourir, pour plus jamais te voir Parfois j'aimerais mourir, tellement y'a plus d'espoir Parfois j'aimerais mourir, pour plus jamais te revoir Parfois j'aimerais mourir, pour ne plus rien savoir Je ne t'aime plus mon amour Je ne t'aime plus tous les jours Je ne t'aime plus mon amour Je ne t'aime plus tous les jours",66,3xoAUqjKs7Ps7wR26VAMbq,Clandestino,1998-10-06,Paraíso Tropical,2v41efarffe6iY8qpMK5Gj,latin,tropical,149.80700000000004,158427,en